ffff9f802a787a40 690792870 S Ci:3:067:0 s 80 06 0100 0000 0012 18 <
ffff9f802a787a40 690795417 C Ci:3:067:0 0 18 = 12011001 02000040 34127856 00020102 0301
ffff9f802a787a40 690795431 S Ci:3:067:0 s 80 06 0200 0000 0009 9 <
ffff9f802a787a40 690799416 C Ci:3:067:0 0 9 = 09024b00 02010080 32
ffff9f802a787a40 690799424 S Ci:3:067:0 s 80 06 0200 0000 004b 75 <
ffff9f802a787a40 690803415 C Ci:3:067:0 0 75 = 09024b00 02010080 32080b00 02020201 00090400 00010202 01000524 00100105
ffff9f802a787e00 690803427 S Ci:3:067:0 s 80 06 0300 0000 00ff 255 <
ffff9f802a787e00 690807416 C Ci:3:067:0 0 4 = 04030904
ffff9f802a787e00 690807422 S Ci:3:067:0 s 80 06 0302 0409 00ff 255 <
ffff9f802a787e00 690811416 C Ci:3:067:0 0 38 = 26035500 53004200 20004500 78006100 6d007000 6c006500 20004400 65007600
ffff9f802a787e00 690811425 S Ci:3:067:0 s 80 06 0301 0409 00ff 255 <
ffff9f802a787e00 690815416 C Ci:3:067:0 0 12 = 0c034700 47004500 54004100
ffff9f802a787e00 690815425 S Ci:3:067:0 s 80 06 0303 0409 00ff 255 <
ffff9f802a787e00 690819415 C Ci:3:067:0 0 14 = 0e033100 32003300 34003500 3600
ffff9f802a787e00 690855564 S Co:3:067:0 s 00 09 0001 0000 0000 0
ffff9f802a787e00 690856537 C Co:3:067:0 0 0
ffff9f802a7866c0 690856587 S Co:3:067:0 s 21 20 0000 0000 0007 7 = 80250000 000008
ffff9f802a7866c0 690860412 C Co:3:067:0 0 7 >
ffff9f802a787e00 691476571 S Ii:3:067:1 -115:8 64 <
ffff9f802a7863c0 691476585 S Bi:3:067:2 -115 128 <
ffff9f802a786000 691476587 S Bi:3:067:2 -115 128 <
ffff9f802a787680 691476589 S Bi:3:067:2 -115 128 <
ffff9f802a786d80 691476591 S Bi:3:067:2 -115 128 <
ffff9f802a787c80 691476593 S Bi:3:067:2 -115 128 <
ffff9f802a786240 691476595 S Bi:3:067:2 -115 128 <
ffff9f802a787080 691476597 S Bi:3:067:2 -115 128 <
ffff9f802a787800 691476599 S Bi:3:067:2 -115 128 <
ffff9f802a786780 691476601 S Bi:3:067:2 -115 128 <
ffff9f802a786fc0 691476603 S Bi:3:067:2 -115 128 <
ffff9f802a786b40 691476605 S Bi:3:067:2 -115 128 <
ffff9f802a786480 691476608 S Bi:3:067:2 -115 128 <
ffff9f802a786c00 691476610 S Bi:3:067:2 -115 128 <
ffff9f802a787500 691476612 S Bi:3:067:2 -115 128 <
ffff9f802a786300 691476614 S Bi:3:067:2 -115 128 <
ffff9f802a787bc0 691476616 S Bi:3:067:2 -115 128 <
ffff9f7e7e7eb680 691476621 S Co:3:067:0 s 21 22 0003 0000 0000 0
ffff9f802a7863c0 695583608 C Bi:3:067:2 -32 0
ffff9f7e7e7eb680 695583644 C Co:3:067:0 -32 0
ffff9f7e7e7eb680 695583681 S Co:3:067:0 s 21 20 0000 0000 0007 7 = 00c20100 000008
ffff9f802a786000 695583683 C Bi:3:067:2 -2 0
ffff9f802a787e00 695583725 C Ii:3:067:1 -32:8 0
ffff9f802a787e00 695583726 S Ii:3:067:1 -115:8 64 <
ffff9f802a787680 695583759 C Bi:3:067:2 -2 0
ffff9f802a786d80 695583877 C Bi:3:067:2 -2 0
ffff9f802a787c80 695583926 C Bi:3:067:2 -2 0
ffff9f7e7e7eb680 695583967 C Co:3:067:0 -71 0
ffff9f7e7e7eb680 695583997 S Co:3:067:0 s 21 20 0000 0000 0007 7 = 00093d00 000008
ffff9f802a786240 695584037 C Bi:3:067:2 -2 0
ffff9f802a787080 695584115 C Bi:3:067:2 -2 0
ffff9f802a787800 695584194 C Bi:3:067:2 -2 0
ffff9f802a786780 695584274 C Bi:3:067:2 -2 0
ffff9f802a786fc0 695584352 C Bi:3:067:2 -2 0
ffff9f802a786b40 695584432 C Bi:3:067:2 -2 0
ffff9f802a786480 695584511 C Bi:3:067:2 -2 0
ffff9f802a786c00 695584594 C Bi:3:067:2 -2 0
ffff9f7e7e7eb680 695584633 C Co:3:067:0 -71 0
ffff9f7e7e7eb680 695584646 S Co:3:067:0 s 21 20 0000 0000 0007 7 = 00c20100 000008
ffff9f802a787500 695584710 C Bi:3:067:2 -2 0
ffff9f802a786300 695584790 C Bi:3:067:2 -2 0
ffff9f802a787bc0 695584869 C Bi:3:067:2 -2 0
ffff9f802a786e40 695584872 S Co:3:067:0 s 02 01 0000 0082 0000 0
ffff9f7e7e7eb680 695585029 C Co:3:067:0 -71 0
ffff9f7e7e7eb680 695585052 S Co:3:067:0 s 21 22 0002 0000 0000 0
ffff9f802a786e40 695587486 C Co:3:067:0 -71 0
ffff9f802a7863c0 695587489 S Bi:3:067:2 -115 128 <
ffff9f802a786000 695587491 S Bi:3:067:2 -115 128 <
ffff9f802a787680 695587492 S Bi:3:067:2 -115 128 <
ffff9f802a786d80 695587494 S Bi:3:067:2 -115 128 <
ffff9f802a787c80 695587496 S Bi:3:067:2 -115 128 <
ffff9f802a786240 695587498 S Bi:3:067:2 -115 128 <
ffff9f802a787080 695587500 S Bi:3:067:2 -115 128 <
ffff9f802a787800 695587501 S Bi:3:067:2 -115 128 <
ffff9f802a786780 695587503 S Bi:3:067:2 -115 128 <
ffff9f802a786fc0 695587505 S Bi:3:067:2 -115 128 <
ffff9f802a786b40 695587506 S Bi:3:067:2 -115 128 <
ffff9f802a786480 695587508 S Bi:3:067:2 -115 128 <
ffff9f802a786c00 695587509 S Bi:3:067:2 -115 128 <
ffff9f802a787500 695587512 S Bi:3:067:2 -115 128 <
ffff9f802a786300 695587513 S Bi:3:067:2 -115 128 <
ffff9f802a787bc0 695587515 S Bi:3:067:2 -115 128 <
ffff9f802a7863c0 695587605 C Bi:3:067:2 -71 0
ffff9f7e7e7eb680 695588155 C Co:3:067:0 -71 0
ffff9f802a786000 695588156 C Bi:3:067:2 -71 0
ffff9f802a787680 695588900 C Bi:3:067:2 -71 0
ffff9f802a7866c0 695589030 C Co:3:004:0 0 0
ffff9f802a7866c0 695589072 S Co:3:004:0 s 23 08 9052 0001 0000 0
ffff9f802a786d80 695589149 C Bi:3:067:2 -71 0
ffff9f802a7866c0 695589280 C Co:3:004:0 0 0
ffff9f802a7866c0 695589322 S Co:3:004:0 s 23 08 9052 0001 0000 0
ffff9f802a787c80 695589400 C Bi:3:067:2 -71 0
ffff9f802a7866c0 695589530 C Co:3:004:0 0 0
ffff9f802a7866c0 695589575 S Co:3:004:0 s 23 08 9052 0001 0000 0
ffff9f802a786240 695589649 C Bi:3:067:2 -71 0
ffff9f802a7866c0 695589781 C Co:3:004:0 0 0
ffff9f802a7866c0 695589823 S Co:3:004:0 s 23 08 9052 0001 0000 0
ffff9f802a787080 695589899 C Bi:3:067:2 -71 0
ffff9f802a7866c0 695590030 C Co:3:004:0 0 0
ffff9f802a7866c0 695590073 S Co:3:004:0 s 23 08 9052 0001 0000 0
ffff9f802a787800 695590150 C Bi:3:067:2 -71 0
ffff9f802a7866c0 695590280 C Co:3:004:0 0 0
ffff9f802a7866c0 695590323 S Co:3:004:0 s 23 08 9052 0001 0000 0
ffff9f802a786780 695590401 C Bi:3:067:2 -71 0
ffff9f802a7866c0 695590530 C Co:3:004:0 0 0
ffff9f802a7866c0 695590573 S Co:3:004:0 s 23 08 9052 0001 0000 0
ffff9f802a786fc0 695590650 C Bi:3:067:2 -71 0
ffff9f802a7866c0 695590780 C Co:3:004:0 0 0
ffff9f802a7866c0 695590822 S Co:3:004:0 s 23 08 9052 0001 0000 0
ffff9f802a786b40 695590900 C Bi:3:067:2 -71 0
ffff9f802a7866c0 695591030 C Co:3:004:0 0 0
ffff9f802a7866c0 695591072 S Co:3:004:0 s 23 08 9052 0001 0000 0
ffff9f802a786480 695591150 C Bi:3:067:2 -71 0
ffff9f802a7866c0 695591280 C Co:3:004:0 0 0
ffff9f802a7866c0 695591322 S Co:3:004:0 s 23 08 9052 0001 0000 0
ffff9f802a786c00 695591400 C Bi:3:067:2 -71 0
ffff9f802a7866c0 695591439 C Co:3:004:0 0 0
ffff9f802a7866c0 695591481 S Co:3:004:0 s 23 08 9052 0001 0000 0
ffff9f802a787500 695591559 C Bi:3:067:2 -71 0
ffff9f802a7866c0 695591560 C Co:3:004:0 0 0
ffff9f802a7866c0 695591601 S Co:3:004:0 s 23 08 9052 0001 0000 0
ffff9f802a786300 695591680 C Bi:3:067:2 -71 0
ffff9f802a7866c0 695591681 C Co:3:004:0 0 0
ffff9f802a787e00 695591760 C Ii:3:067:1 -32:8 0
ffff9f802a787e00 695591761 S Ii:3:067:1 -115:8 64 <
ffff9f802a7866c0 695591765 S Co:3:004:0 s 23 08 9052 0001 0000 0
ffff9f802a7866c0 695591799 C Co:3:004:0 0 0
ffff9f802a787bc0 695591838 C Bi:3:067:2 -71 0
ffff9f802a787e00 695599736 C Ii:3:067:1 -32:8 0
ffff9f802a787e00 695599738 S Ii:3:067:1 -115:8 64 <
ffff9f802a787e00 695607736 C Ii:3:067:1 -32:8 0
ffff9f802a787e00 695607737 S Ii:3:067:1 -115:8 64 <
ffff9f802a787e00 695615736 C Ii:3:067:1 -32:8 0
ffff9f802a787e00 695615737 S Ii:3:067:1 -115:8 64 <
ffff9f802a787e00 695623736 C Ii:3:067:1 -32:8 0
ffff9f802a787e00 695623737 S Ii:3:067:1 -115:8 64 <
ffff9f7e456ea0c0 695623911 C Ii:3:004:1 0:2048 1 = 04
ffff9f7e456ea0c0 695623915 S Ii:3:004:1 -115:2048 1 <
ffff9f802a7866c0 695623923 S Ci:3:004:0 s a3 00 0000 0002 0004 4 <
ffff9f802a7866c0 695624156 C Ci:3:004:0 0 4 = 00010100
ffff9f802a7866c0 695624159 S Co:3:004:0 s 23 01 0010 0002 0000 0
ffff9f802a7866c0 695624405 C Co:3:004:0 0 0
ffff9f802a787e00 695624512 C Ii:3:067:1 -108:8 0
ffff9f802a787bc0 695655522 S Ci:3:004:0 s a3 00 0000 0002 0004 4 <
ffff9f802a787bc0 695655783 C Ci:3:004:0 0 4 = 00010000
ffff9f802a787bc0 695689530 S Ci:3:004:0 s a3 00 0000 0002 0004 4 <
ffff9f802a787bc0 695689783 C Ci:3:004:0 0 4 = 00010000
ffff9f802a787bc0 695726198 S Ci:3:004:0 s a3 00 0000 0002 0004 4 <
ffff9f802a787bc0 695726410 C Ci:3:004:0 0 4 = 01010100
ffff9f802a787bc0 695726416 S Co:3:004:0 s 23 01 0010 0002 0000 0
ffff9f802a787bc0 695726656 C Co:3:004:0 0 0
ffff9f802a787bc0 695759536 S Ci:3:004:0 s a3 00 0000 0002 0004 4 <
ffff9f802a787bc0 695759785 C Ci:3:004:0 0 4 = 01010000
ffff9f802a787bc0 695792872 S Ci:3:004:0 s a3 00 0000 0002 0004 4 <
ffff9f802a787bc0 695793035 C Ci:3:004:0 0 4 = 01010000
ffff9f802a787bc0 695826195 S Ci:3:004:0 s a3 00 0000 0002 0004 4 <
ffff9f802a787bc0 695826408 C Ci:3:004:0 0 4 = 01010000
ffff9f802a787bc0 695859527 S Ci:3:004:0 s a3 00 0000 0002 0004 4 <
ffff9f802a787bc0 695859783 C Ci:3:004:0 0 4 = 01010000
ffff9f802a787bc0 695859846 S Co:3:004:0 s 23 03 0004 0002 0000 0
ffff9f802a787bc0 695860031 C Co:3:004:0 0 0
ffff9f802a787bc0 695876196 S Ci:3:004:0 s a3 00 0000 0002 0004 4 <
ffff9f802a787bc0 695876408 C Ci:3:004:0 0 4 = 11010000
ffff9f7e456ea0c0 695879908 C Ii:3:004:1 0:2048 1 = 04
ffff9f7e456ea0c0 695879911 S Ii:3:004:1 -115:2048 1 <
ffff9f802a787bc0 695892862 S Ci:3:004:0 s a3 00 0000 0002 0004 4 <
ffff9f802a787bc0 695893033 C Ci:3:004:0 0 4 = 03011000
ffff9f802a787bc0 695893037 S Co:3:004:0 s 23 01 0014 0002 0000 0
ffff9f802a787bc0 695893281 C Co:3:004:0 0 0
ffff9f802a787bc0 696049558 S Ci:3:000:0 s 80 06 0100 0000 0040 64 <
ffff9f802a787bc0 696052417 C Ci:3:000:0 0 18 = 12011001 02000040 34127856 00020102 0301
ffff9f802a787bc0 696052421 S Co:3:004:0 s 23 03 0004 0002 0000 0
ffff9f802a787bc0 696052656 C Co:3:004:0 0 0
ffff9f802a787bc0 696066192 S Ci:3:004:0 s a3 00 0000 0002 0004 4 <
ffff9f802a787bc0 696066408 C Ci:3:004:0 0 4 = 11010000
ffff9f802a787bc0 696082860 S Ci:3:004:0 s a3 00 0000 0002 0004 4 <
ffff9f802a787bc0 696083032 C Ci:3:004:0 0 4 = 03011000
ffff9f802a787bc0 696083036 S Co:3:004:0 s 23 01 0014 0002 0000 0
ffff9f802a787bc0 696083281 C Co:3:004:0 0 0
ffff9f802a787bc0 696259527 S Ci:3:068:0 s 80 06 0100 0000 0012 18 <
ffff9f802a787bc0 696259666 C Ci:3:068:0 -32 0
ffff9f802a787bc0 696259670 S Ci:3:068:0 s 80 06 0100 0000 0012 18 <
ffff9f802a787bc0 696259805 C Ci:3:068:0 -32 0
ffff9f802a787bc0 696259809 S Ci:3:068:0 s 80 06 0100 0000 0012 18 <
ffff9f802a787bc0 696259945 C Ci:3:068:0 -32 0
ffff9f802a787bc0 696259953 S Co:3:004:0 s 23 01 0001 0002 0000 0
ffff9f802a787bc0 696260031 C Co:3:004:0 0 0
ffff9f802a787bc0 696260133 S Co:3:004:0 s 23 03 0004 0002 0000 0
ffff9f802a787bc0 696260281 C Co:3:004:0 0 0
ffff9f802a787bc0 696276192 S Ci:3:004:0 s a3 00 0000 0002 0004 4 <
ffff9f802a787bc0 696276408 C Ci:3:004:0 0 4 = 11010000
ffff9f802a787bc0 696292862 S Ci:3:004:0 s a3 00 0000 0002 0004 4 <
ffff9f802a787bc0 696293033 C Ci:3:004:0 0 4 = 03011000
ffff9f802a787bc0 696293036 S Co:3:004:0 s 23 01 0014 0002 0000 0
ffff9f802a787bc0 696293280 C Co:3:004:0 0 0
ffff9f802a787bc0 696449565 S Ci:3:000:0 s 80 06 0100 0000 0040 64 <
ffff9f802a787bc0 696452419 C Ci:3:000:0 0 18 = 12011001 02000040 34127856 00020102 0301
ffff9f802a787bc0 696452425 S Co:3:004:0 s 23 03 0004 0002 0000 0
ffff9f802a787bc0 696452657 C Co:3:004:0 0 0
ffff9f802a787bc0 696466197 S Ci:3:004:0 s a3 00 0000 0002 0004 4 <
ffff9f802a787bc0 696466410 C Ci:3:004:0 0 4 = 11010000
ffff9f802a787bc0 696482862 S Ci:3:004:0 s a3 00 0000 0002 0004 4 <
ffff9f802a787bc0 696483034 C Ci:3:004:0 0 4 = 03011000
ffff9f802a787bc0 696483040 S Co:3:004:0 s 23 01 0014 0002 0000 0
ffff9f802a787bc0 696483282 C Co:3:004:0 0 0
ffff9f7e455f09c0 696529582 S Bo:3:005:3 -115 31 = 55534243 01090000 00000000 00000600 00000000 00000000 00000000 000000
ffff9f7e455f09c0 696529602 C Bo:3:005:3 0 31 >
ffff9f7e455f09c0 696529611 S Bi:3:005:3 -115 13 <
ffff9f7e455f09c0 696529640 C Bi:3:005:3 0 13 = 55534253 01090000 00000000 00
ffff9f802a787bc0 696656208 S Ci:3:069:0 s 80 06 0100 0000 0012 18 <
ffff9f802a787bc0 696658422 C Ci:3:069:0 0 18 = 12011001 02000040 34127856 00020102 0301
ffff9f802a787bc0 696658436 S Ci:3:069:0 s 80 06 0200 0000 0009 9 <
ffff9f802a787bc0 696662418 C Ci:3:069:0 0 9 = 09024b00 02010080 32
ffff9f802a787bc0 696662425 S Ci:3:069:0 s 80 06 0200 0000 004b 75 <
ffff9f802a787bc0 696665420 C Ci:3:069:0 0 75 = 09024b00 02010080 32080b00 02020201 00090400 00010202 01000524 00100105
ffff9f802a786300 696665433 S Ci:3:069:0 s 80 06 0300 0000 00ff 255 <
ffff9f802a786300 696669418 C Ci:3:069:0 0 4 = 04030904
ffff9f802a786300 696669425 S Ci:3:069:0 s 80 06 0302 0409 00ff 255 <
ffff9f802a786300 696672420 C Ci:3:069:0 0 38 = 26035500 53004200 20004500 78006100 6d007000 6c006500 20004400 65007600
ffff9f802a786300 696672431 S Ci:3:069:0 s 80 06 0301 0409 00ff 255 <
ffff9f802a786300 696676418 C Ci:3:069:0 0 12 = 0c034700 47004500 54004100
ffff9f802a786300 696676426 S Ci:3:069:0 s 80 06 0303 0409 00ff 255 <
ffff9f802a786300 696680422 C Ci:3:069:0 0 14 = 0e033100 32003300 34003500 3600
ffff9f802a786300 696743567 S Co:3:069:0 s 00 09 0001 0000 0000 0
ffff9f802a786300 696744541 C Co:3:069:0 0 0
ffff9f802a786e40 696744602 S Co:3:069:0 s 21 20 0000 0000 0007 7 = 80250000 000008
ffff9f802a786e40 696748416 C Co:3:069:0 0 7 >
ffff9f802a786e40 696748604 S Ci:3:004:0 s a3 00 0000 0002 0004 4 <
ffff9f802a786e40 696748783 C Ci:3:004:0 0 4 = 03010000
ffff9f7e455f09c0 698662926 S Bo:3:005:3 -115 31 = 55534243 02090000 00000000 00000600 00000000 00000000 00000000 000000
ffff9f7e455f09c0 698662953 C Bo:3:005:3 0 31 >
ffff9f7e455f09c0 698662963 S Bi:3:005:3 -115 13 <
ffff9f7e455f09c0 698662988 C Bi:3:005:3 0 13 = 55534253 02090000 00000000 00
